<?xml version="1.0" encoding="UTF-8"?>
<specification xmlns="http://opendse.sourceforge.net"
	xmlns:xsi="http://www.w3.org/2001/XMLSchema-instance"
	xsi:schemaLocation="http://opendse.sourceforge.net schema.xsd">
  <architecture>
    <resource id="r2">
      <attributes>
        <attribute name="TYPE" type="STRING">ECU</attribute>
        <attribute name="scheduler" type="STRING">FIXEDPRIORITY_PREEMPTIVE</attribute>
      </attributes>
    </resource>
    <resource id="can">
      <attributes>
        <attribute name="TYPE" type="STRING">CAN</attribute>
        <attribute name="scheduler" type="STRING">FIXEDPRIORITY_NONPREEMPTIVE</attribute>
      </attributes>
    </resource>
    <resource id="r3">
      <attributes>
        <attribute name="TYPE" type="STRING">ECU</attribute>
        <attribute name="scheduler" type="STRING">FIXEDPRIORITY_PREEMPTIVE</attribute>
      </attributes>
    </resource>
    <resource id="r1">
      <attributes>
        <attribute name="TYPE" type="STRING">ECU</attribute>
        <attribute name="scheduler" type="STRING">FIXEDPRIORITY_PREEMPTIVE</attribute>
      </attributes>
    </resource>
    <link id="l1" source="r1" destination="can" orientation="UNDIRECTED"/>
    <link id="l2" source="r2" destination="can" orientation="UNDIRECTED"/>
    <link id="l3" source="r3" destination="can" orientation="UNDIRECTED"/>
  </architecture>
  <application>
    <task id="t4">
      <attributes>
        <attribute name="deadline" type="DOUBLE">4.0</attribute>
        <attribute name="e" type="DOUBLE">1.2</attribute>
        <attribute name="h" type="DOUBLE">5.0</attribute>
      </attributes>
    </task>
    <task id="t5">
      <attributes>
        <attribute name="e" type="DOUBLE">0.5</attribute>
        <attribute name="h" type="DOUBLE">5.0</attribute>
      </attributes>
    </task>
    <task id="t8">
      <attributes>
        <attribute name="e" type="DOUBLE">0.6</attribute>
        <attribute name="h" type="DOUBLE">5.0</attribute>
      </attributes>
    </task>
    <task id="t12">
      <attributes>
        <attribute name="deadline" type="DOUBLE">5.0</attribute>
        <attribute name="e" type="DOUBLE">0.8</attribute>
        <attribute name="h" type="DOUBLE">5.0</attribute>
      </attributes>
    </task>
    <task id="t9">
      <attributes>
        <attribute name="e" type="DOUBLE">0.8</attribute>
        <attribute name="h" type="DOUBLE">5.0</attribute>
      </attributes>
    </task>
    <task id="t1">
      <attributes>
        <attribute name="e" type="DOUBLE">0.8</attribute>
        <attribute name="h" type="DOUBLE">5.0</attribute>
      </attributes>
    </task>
    <task id="t3">
      <attributes>
        <attribute name="deadline" type="DOUBLE">4.0</attribute>
        <attribute name="e" type="DOUBLE">2.0</attribute>
        <attribute name="h" type="DOUBLE">5.0</attribute>
      </attributes>
    </task>
    <communication id="t6">
      <attributes>
        <attribute name="e" type="DOUBLE">0.26</attribute>
        <attribute name="h" type="DOUBLE">5.0</attribute>
      </attributes>
    </communication>
    <communication id="t10">
      <attributes>
        <attribute name="e" type="DOUBLE">0.26</attribute>
        <attribute name="h" type="DOUBLE">5.0</attribute>
      </attributes>
    </communication>
    <communication id="t7">
      <attributes>
        <attribute name="e" type="DOUBLE">0.146</attribute>
        <attribute name="h" type="DOUBLE">5.0</attribute>
      </attributes>
    </communication>
    <communication id="t11">
      <attributes>
        <attribute name="e" type="DOUBLE">0.146</attribute>
        <attribute name="h" type="DOUBLE">5.0</attribute>
      </attributes>
    </communication>
    <communication id="t2">
      <attributes>
        <attribute name="e" type="DOUBLE">0.26</attribute>
        <attribute name="h" type="DOUBLE">5.0</attribute>
      </attributes>
    </communication>
    <dependency id="d-5-7" source="t5" destination="t7" orientation="DIRECTED"/>
    <dependency id="d-5-6" source="t5" destination="t6" orientation="DIRECTED"/>
    <dependency id="d-9-11" source="t9" destination="t11" orientation="DIRECTED"/>
    <dependency id="d-10-12" source="t10" destination="t12" orientation="DIRECTED"/>
    <dependency id="d-8-10" source="t8" destination="t10" orientation="DIRECTED"/>
    <dependency id="d-2-4" source="t2" destination="t4" orientation="DIRECTED"/>
    <dependency id="d-11-12" source="t11" destination="t12" orientation="DIRECTED"/>
    <dependency id="d-2-3" source="t2" destination="t3" orientation="DIRECTED"/>
    <dependency id="d-1-2" source="t1" destination="t2" orientation="DIRECTED"/>
    <dependency id="d-7-9" source="t7" destination="t9" orientation="DIRECTED"/>
    <dependency id="d-6-8" source="t6" destination="t8" orientation="DIRECTED"/>
    <functions>
      <function anchor="t4">
        <attributes>
          <attribute name="ID" type="STRING">func1</attribute>
        </attributes>
      </function>
      <function anchor="t5">
        <attributes>
          <attribute name="ID" type="STRING">func0</attribute>
        </attributes>
      </function>
    </functions>
  </application>
  <mappings>
    <mapping id="m1" source="t1" target="r3"/>
    <mapping id="m3" source="t3" target="r1"/>
    <mapping id="m4" source="t4" target="r2"/>
    <mapping id="m5" source="t5" target="r1"/>
    <mapping id="m8" source="t8" target="r3"/>
    <mapping id="m9" source="t9" target="r3"/>
    <mapping id="m12" source="t12" target="r2"/>
  </mappings>
  <routings>
    <routing source="t6">
      <resource id="can"/>
      <resource id="r3"/>
      <resource id="r1"/>
      <link id="l1" source="r1" destination="can" orientation="DIRECTED"/>
      <link id="l3" source="can" destination="r3" orientation="DIRECTED"/>
    </routing>
    <routing source="t10">
      <resource id="r2"/>
      <resource id="can"/>
      <resource id="r3"/>
      <link id="l2" source="can" destination="r2" orientation="DIRECTED"/>
      <link id="l3" source="r3" destination="can" orientation="DIRECTED"/>
    </routing>
    <routing source="t7">
      <resource id="can"/>
      <resource id="r3"/>
      <resource id="r1"/>
      <link id="l1" source="r1" destination="can" orientation="DIRECTED"/>
      <link id="l3" source="can" destination="r3" orientation="DIRECTED"/>
    </routing>
    <routing source="t11">
      <resource id="r2"/>
      <resource id="can"/>
      <resource id="r3"/>
      <link id="l2" source="can" destination="r2" orientation="DIRECTED"/>
      <link id="l3" source="r3" destination="can" orientation="DIRECTED"/>
    </routing>
    <routing source="t2">
      <resource id="r2"/>
      <resource id="can"/>
      <resource id="r3"/>
      <resource id="r1"/>
      <link id="l1" source="can" destination="r1" orientation="DIRECTED"/>
      <link id="l2" source="can" destination="r2" orientation="DIRECTED"/>
      <link id="l3" source="r3" destination="can" orientation="DIRECTED"/>
    </routing>
  </routings>
</specification>
