<?xml version="1.0" encoding="UTF-8"?>
<specification xmlns="http://opendse.sourceforge.net"
	xmlns:xsi="http://www.w3.org/2001/XMLSchema-instance"
	xsi:schemaLocation="http://opendse.sourceforge.net schema.xsd"  xmlns:test="http://opendse.sourceforge.net">
  <architecture>
    <resource id="r1">
      <attributes>
        <attribute name="costs" type="INT">100</attribute>
      </attributes>
    </resource>
    <resource id="r2">
      <attributes>
        <attribute name="costs" type="INT">50</attribute>
      </attributes>
    </resource>
    <link id="l1" source="r1" destination="r2" type="UNDIRECTED"/>
  </architecture>
  <application>
    <task id="t2"/>
    <task id="t1"/>
    <dependency id="d1" source="t1" destination="t2" type="DIRECTED"/>
    <functions>
      <function anchor="t2">
        <attributes>
          <attribute name="ID" type="STRING">func0</attribute>
        </attributes>
      </function>
    </functions>
  </application>
  <mappings>
    <mapping id="m1" source="t1" target="r1"/>
    <mapping id="m2" source="t2" target="r2"/>
  </mappings>
  <routings/>
</specification>
